{
  "id": "BlazingSacrificialHeartsHesitance",
  "name": "Hésitation du cœur sacrificiel flamboyant",
  "description": "Alors que les civilisations originelles s'effondraient comme du jade brisé, et que les créatures célestes, sous la conduite desquelles les civilisations terrestres avaient prospéré, étaient dévorées par les dragons éveillés, l'humanité s'enfonça dans la sauvagerie, perdant la capacité de percevoir le monde d'une manière nouvelle. C'est ainsi qu'ils revinrent à leurs croyances les plus primitives, convaincus du mystère inhérent à la terre qui nourrissait toutes choses. Cela marqua l'aube de l'ère où les proies chassées commencèrent à être offertes en sacrifice.",
  "source": [
    "Synthèse"
  ],
  "rarity": 3,
  "craft": {
    "cost": 125,
    "items": [
      {
        "id": "BlazingSacrificialHeartsTerror",
        "name": "Terreur du cœur sacrificiel flamboyant",
        "amount": 3
      }
    ]
  },
  "version": "5.0"
}