{
  "id": "GoldenRavenInsignia",
  "name": "Insignia de cuervo dorada",
  "description": "Una insignia de cuervo que simboliza el orgullo y los principios por los que se rigen los Ladrones de Tesoros. Ya sea ocultos en las profundidades de la tierra o en el insondable fondo del mar, mientras haya tesoros que cazar, el inmortal espíritu de los Ladrones de Tesoros no se detendrá ante nada para obtenerlos.",
  "source": [
    "Sintetizar",
    "Obtenido de Ladrones de Tesoros (Niv. 60+)",
    "Sintetizar",
    "Obtenido de Ladrones de Tesoros (Niv. 60+)"
  ],
  "rarity": 3,
  "craft": {
    "cost": 50,
    "items": [
      {
        "id": "SilverRavenInsignia",
        "name": "Insignia de cuervo plateada",
        "amount": 3
      },
      {
        "id": "SilverRavenInsignia",
        "name": "Insignia de cuervo plateada",
        "amount": 3
      }
    ]
  },
  "version": "5.0"
}