{
  "id": "TransoceanicChunk",
  "name": "Обломок из иноморья",
  "description": "Легенды рассказывают о великих существах, которые живут в далёких морях, где не проходят морские пути и куда не ступает нога человека, но ни одно обычное море не может похвастаться жизненными силами моря Фонтейна.",
  "source": [
    "Алхимия",
    "Инороды Фонтмера Ур. 40+",
    "Звёздная пыль"
  ],
  "rarity": 2,
  "craft": {
    "cost": 25,
    "items": [
      {
        "id": "TransoceanicPearl",
        "name": "Жемчужина иноморья",
        "amount": 3
      }
    ]
  },
  "version": "4.0"
}