{
  "id": "BlackCrystalHorn",
  "name": "Schwarzes Kristallhorn",
  "description": "Ein leuchtendes Metallhorn, versehen mit unbekannten dunklen Kristallverzierungen. Es scheint kaum benutzt worden zu sein und muss wohl f√ºr wichtige Hilichurl-Rituale vorgesehen sein.",
  "source": [
    "Kann hergestellt werden",
    "Beute von Mitachurlen ab Stufe 60",
    "Beute von Lawachurlen ab Stufe 60"
  ],
  "rarity": 4,
  "craft": {
    "cost": 125,
    "items": [
      {
        "id": "BlackBronzeHorn",
        "name": "Kupferhorn",
        "amount": 3
      }
    ]
  },
  "version": "1.6"
}