{
  "id": "SpectralHeart",
  "name": "Cœur spectral",
  "description": "Ces formes de vie élémentaires ont des habitudes de comportement étranges et augmenteront périodiquement leur nombre avant de disparaître.",
  "source": [
    "Synthèse",
    "Butin de Spectre (Niv.40+)",
    "Échange Astrions"
  ],
  "rarity": 2,
  "craft": {
    "cost": 25,
    "items": [
      {
        "id": "SpectralHusk",
        "name": "Coquille spectrale",
        "amount": 3
      }
    ]
  },
  "version": "2.1"
}