{
  "id": "TrimmedRedSilk",
  "name": "Seta rossa ritagliata",
  "description": "Un guerriero esperto può intuire la debolezza dagli occhi del proprio avversario e trarne vantaggio. Da tempo, gli Eremiti hanno perso un padrone da servire, e ora non hanno più nessuno di cui fidarsi. Si dice che siano fermamente convinti che il tradimento si nasconda dietro ogni cosa, persino dietro ai loro stessi occhi.",
  "source": [
    "Creato",
    "Ottenibile dagli Eremiti di liv. 40+",
    "Scambio di Polvere stellare",
    "Creato",
    "Ottenibile dagli Eremiti di liv. 40+",
    "Scambio di Polvere stellare"
  ],
  "rarity": 2,
  "craft": {
    "cost": 25,
    "items": [
      {
        "id": "FadedRedSatin",
        "name": "Seta rossa sbiadita",
        "amount": 3
      },
      {
        "id": "FadedRedSatin",
        "name": "Seta rossa sbiadita",
        "amount": 3
      }
    ]
  },
  "version": "5.0"
}