{
  "id": "ConcealedUnguis",
  "name": "Скрытый заточенный коготь",
  "description": "Они очень любопытны, но с Дурином, шедевром гумусового слоя, эти псы элювиального слоя не идут ни в какое сравнение.",
  "source": [
    "Алхимия",
    "Волки Разрыва Ур. 40+",
    "Покупается за Звёздную пыль",
    "Алхимия",
    "Волки Разрыва Ур. 40+",
    "Покупается за Звёздную пыль"
  ],
  "rarity": 3,
  "craft": {
    "cost": 50,
    "items": [
      {
        "id": "ConcealedClaw",
        "name": "Скрытый коготь",
        "amount": 3
      },
      {
        "id": "ConcealedClaw",
        "name": "Скрытый коготь",
        "amount": 3
      }
    ]
  },
  "version": "5.0"
}