{
  "id": "ForeignSynapse",
  "name": "이세계의 시냅스",
  "description": "이런 특이한 생명체의 근원은 엘리나스이며, 활동 범위 역시 엘리나스를 중심으로 돌아간다",
  "source": [
    "합성 획득",
    "Lv.40 이상 균열계 원형체 드랍",
    "스타더스트 교환"
  ],
  "rarity": 3,
  "craft": {
    "cost": 50,
    "items": [
      {
        "id": "RiftCore",
        "name": "균열의 코어",
        "amount": 3
      }
    ]
  },
  "version": "4.0"
}